大数据工程助理+年底双薪/社保,NULL,广州-天河区,全职,0年经验,大专,3500-5500,NULL,NULL,"年终奖,绩效奖金,项目奖金,五险一金,交通补贴,餐饮补贴,下午茶充足,员工旅游,节日福利,帅哥美女多,单身多,更多,",岗位职责:在软件开发工程师的的指导下，完成所负责模块的代码编写、模块测试以及文档撰写；2、了解Tomcat等主流应用服务器，熟悉大型关系型数据库，如Oracle、SqlServer；3、关注跟踪行业内的技术变动，引入能够提升产品质量，提高开发效率的新技术和新工具。任职要求1、大专及以上学历，计算机、机电一体化、通信工程等理工科专业优先2、对开发有极大热情的应届生经验不限；3、有很好的沟通能力和领悟能力，思维活跃，能独立思考；4、学习能力强，工作热情高，富有责任感。5、达不到公司招聘技术要求的应聘者，可自愿选择是否参加公司提供的岗前技能提升计划。福利待遇：1、签订劳动合同，公司为员工购买五险一金，享受国家规定的保险福利待遇；2、薪资结构：底薪+绩效奖金+项目提成+项目奖金+社会福利+其他补贴等，试用期1-3个月，转正后按照学历评定薪资，大专底薪4K，本科底薪5K；3、上班时间：9:00-18:00，中午休息两小时，周末双休，不加班，享受国家法定节假日，上下班交通便利，珠村BRT就在公司旁；4、定期组织员工参加户外活动、体育比赛等业余活动，丰富员工的工作生活；5、良好的晋升机制，广阔的晋升空间；6、工作环境舒适，单身帅哥美女多，有下午茶等。公司地址：广州市天河区中山大道中珠村BRT旁盈富大厦4楼乘车路线：附近地铁4号线车陂D出口，转坐B1/B17/B27/B5/B16公交到珠村站下。我们乐于交流宝贵经验、倾听个人心声、保证职员福利、共同学习进步！我们等待着有梦想、有动力的新生力到来！注：未满18周岁，请勿投递！,"
 岗位职责1、在软件开发工程师的的指导下，完成所负责模块的代码编写、模块测试以及文档撰写；2、了解Tomcat等主流应用服务器，熟悉大型关系型数据库，如Oracle、SqlServer；3、关注跟踪行业内的技术变动，引入能够提升产品质量，提高开发效率的新技术和新工具。任职要求1、大专及以上学历，计算机、机电一体化、通信工程等理工科专业优先2、对开发有极大热情的应届生经验不限；3、有很好的沟通能力和领悟能力，思维活跃，能独立思考；4、学习能力强，工作热情高，富有责任感。5、达不到公司招聘技术要求的应聘者，可自愿选择是否参加公司提供的岗前技能提升计划。 福利待遇：1、签订劳动合同，公司为员工购买五险一金，享受国家规定的保险福利待遇；2、薪资结构：底薪+绩效奖金+项目提成+项目奖金+社会福利+其他补贴等，试用期1-3个月，转正后按照学历评定薪资，大专底薪4K，本科底薪5K；3、上班时间：9:00-18:00，中午休息两小时，周末双休，不加班，享受国家法定节假日，上下班交通便利，珠村BRT就在公司旁；4、定期组织员工参加户外活动、体育比赛等业余活动，丰富员工的工作生活；5、良好的晋升机制，广阔的晋升空间；6、工作环境舒适，单身帅哥美女多，有下午茶等。 公司地址：广州市天河区中山大道中珠村BRT旁盈富大厦4楼乘车路线：附近地铁4号线车陂D出口，转坐B1/B17/B27/B5/B16公交到珠村站下。 我们乐于交流宝贵经验、倾听个人心声、保证职员福利、共同学习进步！我们等待着有梦想、有动力的新生力到来！ 注：未满18周岁，请勿投递！
",北京优才创智科技有限公司广州分公司,移动互联网,股份制,NULL, 500人以上,NULL,2017-12-22,http://www.chinahr.com/job/6201455114980865.html,中华英才网
大数据技术顾问,NULL,北京-海淀区,全职,4年经验,本科,15000-20000,NULL,NULL,"年终奖,五险一金,带薪年假,餐饮补贴,差旅补贴,定期体检,员工旅游,节日福利,晋升空间大,领导易相处,优秀人才多,更多,",岗位职责:.CDH大数据集群的部署，调优以及运维;2.Hadoop集群的功能设计，配置管理以及troubleshooting3.能够配合销售人员提供良好的售前技术支持；4.能够引导客户需求，提供解决方案，赢得客户技术认可。职位要求：1.本科及以上学历，3年以上运维/数据库/系统管理员工作经验，1年以上CDH大数据集群独立运维经验；2.熟悉并能熟练操作CDH集群，包括不限于集群安装，高可用配置，LDAP/AD集成，SPSS/SAS集成等；3.能够快速有效的定位并解决CDH/ApacheHadoop集群的问题；4.能够编写batchell/python脚本，对windows/Linux操作系统命令精通；5.熟悉主流的BI、数据仓库产品；6.良好的表达沟通能力，良好的方案编写、讲解与演讲能力；7.具备快速学习能力，一定程度的抗压能力，能够接受适度出差；8.有Cloudera大数据认证证书的人员优先考虑。,"
 职责描述：1. CDH大数据集群的部署，调优以及运维;2. Hadoop集群的功能设计，配置管理以及troubleshooting3. 能够配合销售人员提供良好的售前技术支持；4. 能够引导客户需求，提供解决方案，赢得客户技术认可。职位要求：1. 本科及以上学历，3年以上运维/数据库/系统管理员工作经验，1年以上CDH大数据集群独立运维经验；2. 熟悉并能熟练操作CDH集群，包括不限于集群安装，高可用配置，LDAP/AD集成，SPSS/SAS集成等；3. 能够快速有效的定位并解决CDH/Apache Hadoop集群的问题；4. 能够编写batchell/python脚本，对windows/Linux操作系统命令精通；5. 熟悉主流的BI、数据仓库产品；6. 良好的表达沟通能力，良好的方案编写、讲解与演讲能力；7. 具备快速学习能力，一定程度的抗压能力，能够接受适度出差；8. 有Cloudera大数据认证证书的人员优先考虑。
",上海派拉软件股份有限公司,信息安全,上市公司,NULL, 101－300人,NULL,2017-12-28,http://www.chinahr.com/job/6408273146185221.html,中华英才网
大数据架构师,NULL,上海-青浦区,全职,3年经验,本科,15000-25000,NULL,NULL,"五险一金,带薪年假,绩效奖金,员工培训,",岗位职责:.计算机、电子、通讯、自动化等相关专业，全日制本科及以上学历；2.熟悉java或python语言，有一定软件开发经验；3.熟练掌握linux系统的使用和管理；4.熟悉大数据生态，有hadoop系统的安装、维护和使用经验；5.有较强的英语文献阅读及口语表达能力。有以下3项工作经验可优先考虑：1.具有机器学习等相关领域的工作经验。2.熟悉scala语言，具有Spark应用开发经验。3.参与过其他大数据项目的开发。工作职责：1.负责大数据项目的客户沟通，需求分析等相关售前工作；2.协助大数据项目的硬件网络规划和软件平台的架构设计；3.参与大数据项目的应用开发。,"
 职位要求：1. 计算机、电子、通讯、自动化等相关专业，全日制本科及以上学历；2. 熟悉java或python语言，有一定软件开发经验；3. 熟练掌握linux系统的使用和管理；4. 熟悉大数据生态，有hadoop系统的安装、维护和使用经验；5. 有较强的英语文献阅读及口语表达能力。有以下3项工作经验可优先考虑：1. 具有机器学习等相关领域的工作经验。2. 熟悉scala语言，具有Spark应用开发经验。3. 参与过其他大数据项目的开发。工作职责：1. 负责大数据项目的客户沟通，需求分析等相关售前工作；2. 协助大数据项目的硬件网络规划和软件平台的架构设计；3. 参与大数据项目的应用开发。
",上海威固信息技术股份有限公司,计算机硬件,民营私企,NULL, 51－100人,NULL,2018-1-2,http://www.chinahr.com/job/5548278753265925.html,中华英才网
大数据架构师,NULL,上海-青浦区,全职,3年经验,本科,18000-25000,NULL,NULL,"年终奖,绩效奖金,五险一金,","岗位职责:.数据架构设计：参与公司大型数据分析类项目的架构设计与开发指导，推动架构实现落地。2.企业级数据架构规划：结合业务发展趋势以及技术发展针对公司企业级数据架构进行诊断，给出优化改善建议及对未来1-3年数据架构蓝图规划任职要求：1.擅长hadoop，了解相关技术(MapReduce,Hive,Spark,Kafka,Yarn,Storm)、具备分布式数据存储与计算平台搭建/应用架构设计开发/运维/性能调优相关实践经验；2.精通或者熟悉数据库设计，熟悉Oracle／MySQL/Greenplum等数据库，NoSQL、ElasticSearch等；3.精通数据仓库架构设计开发流程，有数据仓库(DW)/商业智能(BI)/数据统计/ETL相关工作经验；4.思路清晰，主动与业务沟通，了解需求，有大型的BI以及大数据项目的架构设计及开发经验者优先","
 岗位职责：1.数据架构设计：参与公司大型数据分析类项目的架构设计与开发指导，推动架构实现落地。 2.企业级数据架构规划：结合业务发展趋势以及技术发展针对公司企业级数据架构进行诊断，给出优化改善建议及对未来1-3年数据架构蓝图规划 任职要求： 1.擅长hadoop，了解相关技术(MapReduce, Hive, Spark, Kafka, Yarn, Storm)、具备分布式数据存储与计算平台搭建/应用架构设计开发/运维/性能调优 相关实践经验； 2.精通或者熟悉数据库设计，熟悉Oracle／MySQL/Greenplum 等数据库，NoSQL、ElasticSearch等；3.精通数据仓库架构设计开发流程，有数据仓库(DW)/商业智能(BI)/数据统计/ETL 相关工作经验； 4.思路清晰，主动与业务沟通，了解需求，有大型的BI以及大数据项目的架构设计及开发经验者优先
",德邦物流,"物流,仓储",民营私企,NULL, 20人以下,NULL,2017-12-27,http://www.chinahr.com/job/6040076185469441.html,中华英才网
大数据讲师,NULL,苏州-工业园区,全职,2年经验,大专,5000-10000,NULL,NULL,"年终奖,股票期权,项目奖金,五险一金,带薪年假,定期体检,员工培训,下午茶充足,晋升空间大,领导易相处,",岗位职责:1.研究大数据技术、人才市场发展趋势，确保教学内容的专业性和时效性；2.辅助制定和完善大数据技术教学体系；3.完成相关的教学资料（教案、教材、教学PPT、教学案例、教学活动设计等）的研发工作；任职要求：1.熟悉当前大数据技术的进展；2.了解大数据技术的典型应用场景；3.计算机相关专业（或数学类、物理学类、电子信息类的专业，同时具备扎实的计算机专业知识）,"
 岗位职责： 1.研究大数据技术、人才市场发展趋势，确保教学内容的专业性和时效性； 2.辅助制定和完善大数据技术教学体系； 3.完成相关的教学资料（教案、教材、教学PPT、教学案例、教学活动设计等）的研发工作； 任职要求： 1.熟悉当前大数据技术的进展； 2.了解大数据技术的典型应用场景； 3.计算机相关专业（或数学类、物理学类、电子信息类的专业，同时具备扎实的计算机专业知识）
",江苏海鼎信息科技有限公司,移动互联网,民营私企,NULL, 51－100人,NULL,2017-12-7,http://www.chinahr.com/job/5524534966127110.html,中华英才网
大数据开发,NULL,北京-昌平区,全职,0年经验,其他,9000-13000,NULL,NULL,"五险一金,年终奖,弹性工作,节日福利,定期体检,带薪年假,",岗位职责:开发工程师及实习生20名（零基础无专业限制，有意想转行者请联系招聘经理）行业前景：随着大数据产业在全球范围内的快速兴起，国内互联网行业和IT行业的领军企业纷纷进军大数据行业。然而，由于人才培养的滞后，以及新兴行业熟练技术人员积累的不足，大批产业发展所需专业人才严重短缺。薪资待遇：银行、金融机构、国企、电信、上市科技公司等，从事大数据工作。行业前景非常可观，工作2年后工资在20000元以上。工作内容：1、基于hadoop生态的大数据存储平台搭建和部署;2、完成日常数据分析查询需求；3、数据仓库的设计，开发，维护；4、参与大数据分布式应用系统服务器端或客户端软件开发工作（需求开发、故障解决和性能优化等）；任职要求：1.大专以上学历，应/往届毕业生，有志于在IT行业发展；2.专业不限，所含专业包括计算机、电子、软件工程、自动化、测控、机电、机械、土木土建等；3.入职前同意参加四个月集中岗前项目实训，并愿意在北京工作一年以上（特殊情况可协调处理），一年后要求回当地工作的，可协调企业重新安置到原籍省会城市工作。公司提供的薪资待遇为：1、提供员工宿舍，缴纳五险一金；2、早九晚六的工作时间，每周双休，享受正常法定假日；3、转正之后私人订制职业规划书，提供完善的晋升机制；4、享有公司内部的人才培养计划：入职、专业技能、管理能力、领导力培训；只要对IT这行感兴趣，愿意在IT行业长期发展，看好大数据以后的发展趋势的，可以随时投递简历,"
 招聘：大数据开发工程师及实习生20名（零基础无专业限制，有意想转行者请联系招聘经理）行业前景：随着大数据产业在全球范围内的快速兴起，国内互联网行业和IT行业的领军企业纷纷进军大数据行业。然而，由于人才培养的滞后，以及新兴行业熟练技术人员积累的不足，大批产业发展所需专业人才严重短缺。薪资待遇：银行、金融机构、国企、电信、上市科技公司等，从事大数据工作。行业前景非常可观，工作2年后工资在20000元以上。工作内容：1、基于hadoop生态的大数据存储平台搭建和部署;2、完成日常数据分析查询需求；3、数据仓库的设计，开发，维护；4、参与大数据分布式应用系统服务器端或客户端软件开发工作（需求开发、故障解决和性能优化等）；任职要求：1.大专以上学历，应/往届毕业生，有志于在IT行业发展；2.专业不限，所含专业包括计算机、电子、软件工程、自动化、测控、机电、机械、土木土建等；3.入职前同意参加四个月集中岗前项目实训，并愿意在北京工作一年以上（特殊情况可协调处理），一年后要求回当地工作的，可协调企业重新安置到原籍省会城市工作。公司提供的薪资待遇为：1、提供员工宿舍，缴纳五险一金；2、早九晚六的工作时间，每周双休，享受正常法定假日；3、转正之后私人订制职业规划书，提供完善的晋升机制；4、享有公司内部的人才培养计划：入职、专业技能、管理能力、领导力培训；只要对IT这行感兴趣，愿意在IT行业长期发展，看好大数据以后的发展趋势的，可以随时投递简历
",元贞道（北京）文化股份有限公司,广告,民营私企,NULL, 101－300人,NULL,2018-1-2,http://www.chinahr.com/job/6295744804293639.html,中华英才网
大数据开发/人才储备,NULL,杭州-西湖区,全职,0年经验,高中,5000-7000,NULL,NULL,"年终奖,绩效奖金,五险一金,带薪年假,餐饮补贴,弹性工作,下午茶充足,节日福利,领导易相处,单身多,","岗位职责:上学历，专业不限，年龄在30岁以下；2.性格开朗，善于沟通，有团队协作能力；3.工作积极主动，认真负责，有进取心和责任心。福利待遇：1.领导nice，公司氛围好；2.薪资待遇是4k-8k,包含底薪+绩效+补助；3.入职即缴纳法定五险一金；4.定期部门活动，包括聚餐、旅游，还有带薪年假、婚假；。","
 1.大专及以上学历，专业不限，年龄在30岁以下；2.性格开朗，善于沟通，有团队协作能力；3.工作积极主动，认真负责，有进取心和责任心。福利待遇：1.领导nice，公司氛围好；2.薪资待遇是4k-8k,包含底薪+绩效+补助；3.入职即缴纳法定五险一金；4.定期部门活动，包括聚餐、旅游，还有带薪年假、婚假；。
",北京才秀人人科技有限公司,移动互联网,股份制,NULL, 101－300人,NULL,2018-1-3,http://www.chinahr.com/job/6269342955505154.html,中华英才网
大数据开发/运维工程师,NULL,苏州 昆山-NULL,全职,1年经验,本科,5000-9000,NULL,NULL,"优秀人才多,",岗位职责:inux基础命令操作，能够独立编写Shell脚本开展日常服务器的运维。2.熟悉Mysql、Oracle等常用关系型数据库操作，对sql能够进行简单的调优。掌握PLSQL编程更佳。3.了解Hadoop大数据生态圈，熟悉HDFS、HIVE、HBASE、YARN等重要组件更佳。4.了解硬件虚拟化技术，对docker虚拟化技术有一定的接触更佳。,"
 1.熟悉 Linux 基础命令操作，能够独立编写Shell脚本开展日常服务器的运维。2.熟悉Mysql、Oracle等常用关系型数据库操作，对sql能够进行简单的调优。掌握PLSQL编程更佳。3.了解Hadoop大数据生态圈，熟悉HDFS、HIVE、HBASE、YARN等重要组件更佳。4.了解硬件虚拟化技术，对docker虚拟化技术有一定的接触更佳。
",昆山华信软件技术有限公司,计算机软件,民营私企,NULL, 500人以上,NULL,2017-12-7,http://www.chinahr.com/job/6329532405386759.html,中华英才网
大数据开发测试实习生+双休,NULL,西安-雁塔区,全职,0年经验,大专,8000-10000,NULL,NULL,"年终奖,绩效奖金,项目奖金,五险一金,带薪年假,话费补贴,差旅补贴,定期体检,下午茶充足,节日福利,晋升空间大,优秀人才多,办公装备高档,地处繁华商圈,更多,",岗位职责:、大专及以上学历，计算机相关专业；2、热爱互联网行业，务实进取，善于学习，乐于交流；3、工作认真、细心、负责，有较强的沟通及表达能力，较强的团队合作精神；4、欢迎优秀的应往届毕业生加入；福利待遇：1、薪酬=基本工资+绩效奖金+五险一金+餐补+房补2、每月1次部门员工活动；3、工作满1年后，即可享受带薪年假、婚假、产假等福利；4、每年年度优秀员工可获得一次旅游机会5、节假日发送员工礼品；,"
 任职要求：1、大专及以上学历，计算机相关专业；2、热爱互联网行业，务实进取，善于学习，乐于交流；3、工作认真、细心、负责，有较强的沟通及表达能力，较强的团队合作精神；4、欢迎优秀的应往届毕业生加入；福利待遇：1、薪酬=基本工资+绩效奖金+五险一金+餐补+房补2、每月1次部门员工活动；3、工作满1年后，即可享受带薪年假、婚假、产假等福利；4、每年年度优秀员工可获得一次旅游机会5、节假日发送员工礼品；
",成都汇智动力信息技术有限公司西安分公司,计算机软件,民营私企,NULL, 500人以上,NULL,2018-1-4,http://www.chinahr.com/job/6181708025335043.html,中华英才网
大数据开发定岗生,NULL,郑州-经开区,全职,0年经验,大专,4000-6000,NULL,NULL,"五险一金,年终奖,员工旅游,节日福利,员工培训,带薪年假,",岗位职责:着全行业的深入IT化以及智慧城市建设浪潮的兴起，云计算、大数据应用热潮已经掀开了新的一页。中国一线的云计算巨头，如阿里云、腾讯云等，在2015年数据中心的服务器数量纷纷超过50万台;作为衡量云计算厂商的最基础的硬指标，在2017年，数据中心建设将进入高峰期，有云计算厂商的服务器数量将会突破100万台。,"
 行业前景：随着全行业的深入IT化以及智慧城市建设浪潮的兴起，云计算、大数据应用热潮已经掀开了新的一页。中国一线的云计算巨头，如阿里云、腾讯云等，在2015年数据中心的服务器数量纷纷超过50万台;作为衡量云计算厂商的最基础的硬指标，在2017年，数据中心建设将进入高峰期，有云计算厂商的服务器数量将会突破100万台。
",河南品向文化传播有限公司,计算机服务,民营私企,NULL, 51－100人,NULL,2018-1-4,http://www.chinahr.com/job/6289787101678595.html,中华英才网
大数据开发定岗实习生,NULL,南京 江宁-NULL,全职,0年经验,本科,6000-8000,NULL,NULL,"年终奖,五险一金,带薪年假,住房补贴,晋升空间大,",岗位职责:职要求：从事公司项目组项目研发工作；有较强的逻辑思维能力，良好的代码编写习惯；根据自身想法及创意开发新型项目；和团队一起对软件做出测评；二，任职资格：年龄：18-30岁，大专以上学历（想往IT发展对计算机开发、软件编程行业感兴趣，有长期从事本行业，做一名优秀的软件开发工程师的打算；能把握机遇，想法新颖，大胆；三，福利待遇：1、薪资水平（助理）：根据个人能力水平分配适应的工作内容，根据工作内容、工作态度、考勤、配合度等综合能力评定薪资水平。综合薪资水平可达到4500+2、作息时间：上班期间午休2小时、朝九晚六、、国家法定假休,"
 岗位职责：任职要求：从事公司项目组项目研发工作； 有较强的逻辑思维能力，良好的代码编写习惯； 根据自身想法及创意开发新型项目； 和团队一起对软件做出测评；二，任职资格： 年龄：18-30岁 ，大专以上学历（想往IT发展 对计算机开发、软件编程行业感兴趣，有长期从事本行业，做一名优秀的软件开发工程师的打算； 能把握机遇，想法新颖，大胆；三，福利待遇：1、薪资水平（助理）：根据个人能力水平分配适应的工作内容，根据工作内容、工作态度、考勤、配合度等综合能力评定薪资水平。综合薪资水平可达到4500+ 2、作息时间：上班期间午休2小时、朝九晚六、、国家法定假休 
",南京欧米伽网络科技有限公司,O2O,上市公司,NULL, 500人以上,NULL,2018-1-3,http://www.chinahr.com/job/6179690202893569.html,中华英才网
大数据开发工程师,NULL,深圳-福田区,全职,3年经验,本科,15000-30000,NULL,NULL,"年终奖,绩效奖金,五险一金,餐饮补贴,员工培训,","岗位职责:程师（要求学历：本科薪水：1万-3.5万）1、计算机相关专业、本科以上学历；2、熟悉大数据相关技术（hive、HDFS、MR、HBase、Flume、Kafka、spark、Mongo、ES等），在某一方面有丰富经验优先；3、乐于了解、学习新技术，积极向上，有ApacheMahout、、SparkMLlib、Sklearn、Keras其中一项使用经验者优先。4、熟悉LINUX，具备ETL数据处理经验优先5、有熟悉神经网络者优先,使用过TensorFlow框架者优先6、有算法实践经验并做过预测、推荐算法，能够熟练应用算法做数据特征分析及数据建模的优先职责:1、大数据平台开发，包括大数据处理、业务分析、数据服务开发及部署、实施；2、对数字化运营分析感兴趣，利用机器学习的算法发现数据潜在的价值，提高工作效率为导向开展数据挖掘。3、对于大数据神经网络算法的预测与价值分析","
 大数据开发工程师（要求学历：本科 薪水：1万-3.5万）1、计算机相关专业、本科以上学历；2、熟悉大数据相关技术（hive、HDFS、MR、HBase、Flume、Kafka、spark、Mongo、ES等），在某一方面有丰富经验优先； 3、乐于了解、学习新技术，积极向上，有Apache Mahout、、Spark MLlib、 Sklearn、Keras其中一项使用经验者优先。4、熟悉LINUX，具备ETL数据处理经验优先5、有熟悉神经网络者优先,使用过TensorFlow框架者优先6、有算法实践经验并做过预测、推荐算法，能够熟练应用算法做数据特征分析及数据建模的优先职责:1、大数据平台开发，包括大数据处理、业务分析 、数据服务开发及部署、实施；2、对数字化运营分析感兴趣，利用机器学习的算法发现数据潜在的价值，提高工作效率为导向开展数据挖掘。3、对于大数据神经网络算法的预测与价值分析
",上海护腾信息科技有限公司,计算机软件,民营私企,NULL, 101－300人,NULL,2017-11-10,http://www.chinahr.com/job/6316328202765827.html,中华英才网
